<?xml version="1.0" encoding="UTF-8"?>
<maps xmlns:xsi="http://www.w3.org/2001/XMLSchema-instance"
      xsi:noNamespaceSchemaLocation="../levels_schema.xsd">
    <map row="4" col="4" name="Karta 1!">
        <tile class="Model.Units.StartTile" x="0" y="0" status="START"/>
        <tile class="Model.Units.WalkableTile" x="0" y="1" status="START"/>
        <tile class="Model.Units.WalkableTile" x="0" y="2" status="START"/>
        <tile class="Model.Units.WalkableTile" x="0" y="3" status="WALKABLE"/>
        <tile class="Model.Units.WalkableTile" x="1" y="3" status="WALKABLE"/>
        <tile class="Model.Units.WalkableTile" x="2" y="3" status="WALKABLE"/>
        <tile class="Model.Units.BuildableTile" x="1" y="0" status="NONWALKABLE"/>
        <tile class="Model.Units.BuildableTile" x="2" y="0" status="NONWALKABLE"/>
        <tile class="Model.Units.BuildableTile" x="3" y="0" status="NONWALKABLE"/>
        <tile class="Model.Units.BuildableTile" x="1" y="1" status="NONWALKABLE"/>
        <tile class="Model.Units.BuildableTile" x="2" y="1" status="NONWALKABLE"/>
        <tile class="Model.Units.BuildableTile" x="3" y="1" status="NONWALKABLE"/>
        <tile class="Model.Units.BuildableTile" x="1" y="2" status="NONWALKABLE"/>
        <tile class="Model.Units.BuildableTile" x="2" y="2" status="NONWALKABLE"/>
        <tile class="Model.Units.BuildableTile" x="3" y="2" status="NONWALKABLE"/>
        <tile class="Model.Units.GoalTile" x="3" y="3" status="GOAL"/>
    </map>
    <map row="4" col="4" name="Karta 2!"
           xmlns:xsi="http://www.w3.org/2001/XMLSchema-instance"
           xsi:noNamespaceSchemaLocation="../levels_schema.xsd">
        <tile class="Model.Units.StartTile" x="0" y="0" status="START"/>
        <tile class="Model.Units.WalkableTile" x="0" y="1" status="WALKABLE"/>
        <tile class="Model.Units.WalkableTile" x="0" y="2" status="WALKABLE"/>
        <tile class="Model.Units.WalkableTile" x="0" y="3" status="WALKABLE"/>
        <tile class="Model.Units.WalkableTile" x="1" y="3" status="WALKABLE"/>
        <tile class="Model.Units.WalkableTile" x="2" y="3" status="WALKABLE"/>
        <tile class="Model.Units.BuildableTile" x="1" y="0" status="NONWALKABLE"/>
        <tile class="Model.Units.BuildableTile" x="2" y="0" status="NONWALKABLE"/>
        <tile class="Model.Units.BuildableTile" x="3" y="0" status="NONWALKABLE"/>
        <tile class="Model.Units.BuildableTile" x="1" y="1" status="NONWALKABLE"/>
        <tile class="Model.Units.BuildableTile" x="2" y="1" status="NONWALKABLE"/>
        <tile class="Model.Units.BuildableTile" x="3" y="1" status="NONWALKABLE"/>
        <tile class="Model.Units.BuildableTile" x="1" y="2" status="NONWALKABLE"/>
        <tile class="Model.Units.BuildableTile" x="2" y="2" status="NONWALKABLE"/>
        <tile class="Model.Units.BuildableTile" x="3" y="2" status="NONWALKABLE"/>
        <tile class="Model.Units.GoalTile" x="3" y="3" status="GOAL"/>
    </map>
</maps>
